{
  "schemaVersion": 1,
  "id": "FA-ADJ-DIGIT-ARABIC-INDIC-8-001",
  "policyVersion": "1.0.0",
  "profileId": "fa-ir-g1",
  "decisionItemId": "FA-DIGIT-ARABIC-INDIC-8",
  "queueId": "FA-REVIEW-036",
  "packetId": "FA-EVIDENCE-036",
  "planItemId": "FA-ADJ-PLAN-036",
  "phase1Classification": "REVIEW-REQUIRED",
  "track": "implementation-alignment",
  "disposition": "accept-rule",
  "decision": {
    "result": "approved",
    "authority": "project-maintainer",
    "recordedBy": "Soroush Neyestani",
    "recordedAt": null
  },
  "basis": {
    "evidencePacketPath": "spec/fa-ir/review/evidence-packets/records/fa-digit-arabic-indic-8.json",
    "evidencePacketSha256": "9A84831852D1BA2E31D3E298746A83EDB5943C0C0DC084E2E0FDE556C4003D20",
    "sourceIds": [
      "SRC-LEGACY-V1",
      "SRC-LIBLOUIS-2054",
      "SRC-LIBLOUIS-G1"
    ],
    "stableDraftRelationship": "same-observed-behavior",
    "unresolvedEvidenceGaps": []
  },
  "materialization": {
    "kind": "rule",
    "createsSpecificationArtifact": true,
    "targetRuleType": "character",
    "promotionEligible": false,
    "requiresFuturePromotionGovernance": true
  },
  "scope": {
    "projectSpecificationDecision": true,
    "projectNormativeRule": false,
    "officialIranianStandardClaim": false,
    "phase1ClassificationRewritten": false
  },
  "rationale": "Stable and draft Liblouis implementations agree on this digit mapping, and the preserved legacy v1 evidence independently supports the same digit-family behavior. The project accepts the aligned character mapping while keeping number-mode semantics in separate numeric rules."
}
