{
  "schemaVersion": 1,
  "id": "FA-ADJ-REM-003-001",
  "policyVersion": "1.0.0",
  "profileId": "fa-ir-g1",
  "decisionItemId": "FA-REM-003",
  "queueId": "FA-REVIEW-170",
  "packetId": "FA-EVIDENCE-170",
  "planItemId": "FA-ADJ-PLAN-170",
  "phase1Classification": "REVIEW-REQUIRED",
  "track": "implementation-alignment",
  "disposition": "defer-pending-evidence",
  "decision": {
    "result": "deferred",
    "authority": "project-maintainer",
    "recordedBy": "Soroush Neyestani",
    "recordedAt": null
  },
  "basis": {
    "evidencePacketPath": "spec/fa-ir/review/evidence-packets/records/fa-rem-003.json",
    "evidencePacketSha256": "27B956E35ED823FC5B4911DFEC4FBAAE91999FED0E0B14308F61F420D1A406E7",
    "sourceIds": [
      "SRC-IR-1393",
      "SRC-LIBLOUIS-2053",
      "SRC-LIBLOUIS-2054",
      "SRC-LIBLOUIS-G1"
    ],
    "stableDraftRelationship": "same-observed-behavior",
    "unresolvedEvidenceGaps": [
      "The current project audit has not independently verified this remaining-coverage mapping beyond aligned implementation evidence."
    ]
  },
  "materialization": {
    "kind": "deferred",
    "createsSpecificationArtifact": false,
    "targetRuleType": null,
    "promotionEligible": false,
    "requiresFuturePromotionGovernance": false
  },
  "scope": {
    "projectSpecificationDecision": true,
    "projectNormativeRule": false,
    "officialIranianStandardClaim": false,
    "phase1ClassificationRewritten": false
  },
  "rationale": "Stable and draft implementations agree on this remaining-coverage mapping, but the Phase 1 audit explicitly did not verify the mapping against sufficiently authoritative project evidence. Agreement between implementations alone is not enough to make it a project specification rule, especially where dot 7/8 mappings may be involved. The project therefore defers this decision."
}
