{
  "schemaVersion": 1,
  "id": "FA-ADJ-WS-023-001",
  "policyVersion": "1.0.0",
  "profileId": "fa-ir-g1",
  "decisionItemId": "FA-WS-023",
  "queueId": "FA-REVIEW-163",
  "packetId": "FA-EVIDENCE-163",
  "planItemId": "FA-ADJ-PLAN-163",
  "phase1Classification": "REVIEW-REQUIRED",
  "track": "implementation-alignment",
  "disposition": "accept-layout-policy",
  "decision": {
    "result": "approved",
    "authority": "project-maintainer",
    "recordedBy": "Soroush Neyestani",
    "recordedAt": null
  },
  "basis": {
    "evidencePacketPath": "spec/fa-ir/review/evidence-packets/records/fa-ws-023.json",
    "evidencePacketSha256": "95822F36093F91E85DE9DEC68F6FFA581C1AF785EAC110A0B6F8FFD21D84416A",
    "sourceIds": [
      "SRC-IR-1393",
      "SRC-LIBLOUIS-2053",
      "SRC-LIBLOUIS-2054",
      "SRC-LIBLOUIS-G1"
    ],
    "stableDraftRelationship": "same-observed-behavior",
    "unresolvedEvidenceGaps": []
  },
  "materialization": {
    "kind": "layout-policy",
    "createsSpecificationArtifact": true,
    "targetRuleType": "layout",
    "promotionEligible": false,
    "requiresFuturePromotionGovernance": true
  },
  "scope": {
    "projectSpecificationDecision": true,
    "projectNormativeRule": false,
    "officialIranianStandardClaim": false,
    "phase1ClassificationRewritten": false
  },
  "rationale": "Stable and draft implementations agree on this whitespace/layout behavior through the shared spaces utility and any identical Persian-local override. The project accepts it as host/layout policy rather than treating the whitespace code point as an ordinary Persian Braille character rule."
}
