{
  "schemaVersion": 1,
  "id": "FA-ADJ-REM-CTX-006-001",
  "policyVersion": "1.0.0",
  "profileId": "fa-ir-g1",
  "decisionItemId": "FA-REM-CTX-006",
  "queueId": "FA-REVIEW-235",
  "packetId": "FA-EVIDENCE-235",
  "planItemId": "FA-ADJ-PLAN-235",
  "phase1Classification": "REVIEW-REQUIRED",
  "track": "implementation-alignment",
  "disposition": "defer-pending-evidence",
  "decision": {
    "result": "deferred",
    "authority": "project-maintainer",
    "recordedBy": "Soroush Neyestani",
    "recordedAt": null
  },
  "basis": {
    "evidencePacketPath": "spec/fa-ir/review/evidence-packets/records/fa-rem-ctx-006.json",
    "evidencePacketSha256": "E9E3FD25D608FD897F4C593A8FB51DDF76E2D376383802A6C85FCDDA487BCE13",
    "sourceIds": [
      "SRC-LIBLOUIS-2054",
      "SRC-LIBLOUIS-G1"
    ],
    "stableDraftRelationship": "same-observed-behavior",
    "unresolvedEvidenceGaps": [
      "Independent source evidence for this remaining-coverage context directive has not yet been established by the project."
    ]
  },
  "materialization": {
    "kind": "deferred",
    "createsSpecificationArtifact": false,
    "targetRuleType": null,
    "promotionEligible": false,
    "requiresFuturePromotionGovernance": false
  },
  "scope": {
    "projectSpecificationDecision": true,
    "projectNormativeRule": false,
    "officialIranianStandardClaim": false,
    "phase1ClassificationRewritten": false
  },
  "rationale": "Stable and draft implementations agree on this context directive, but the preserved review surface contains no independent manual or legacy evidence establishing it as a Persian project rule. The project defers it instead of treating implementation agreement as normative evidence."
}
