{
  "schemaVersion": 1,
  "id": "FA-ADJ-PUNC-011-001",
  "policyVersion": "1.0.0",
  "profileId": "fa-ir-g1",
  "decisionItemId": "FA-PUNC-011",
  "queueId": "FA-REVIEW-075",
  "packetId": "FA-EVIDENCE-075",
  "planItemId": "FA-ADJ-PLAN-075",
  "phase1Classification": "REVIEW-REQUIRED",
  "track": "implementation-alignment",
  "disposition": "accept-rule",
  "decision": {
    "result": "approved",
    "authority": "project-maintainer",
    "recordedBy": "Soroush Neyestani",
    "recordedAt": null
  },
  "basis": {
    "evidencePacketPath": "spec/fa-ir/review/evidence-packets/records/fa-punc-011.json",
    "evidencePacketSha256": "38223560AE61C69F203B23E238C7CC4F97908C6F690C4F2E1AE8546C3BFE29BB",
    "sourceIds": [
      "SRC-IR-1393",
      "SRC-LEGACY-V1",
      "SRC-LIBLOUIS-2053",
      "SRC-LIBLOUIS-2054",
      "SRC-LIBLOUIS-G1"
    ],
    "stableDraftRelationship": "same-observed-behavior",
    "unresolvedEvidenceGaps": []
  },
  "materialization": {
    "kind": "rule",
    "createsSpecificationArtifact": true,
    "targetRuleType": "character",
    "promotionEligible": false,
    "requiresFuturePromotionGovernance": true
  },
  "scope": {
    "projectSpecificationDecision": true,
    "projectNormativeRule": false,
    "officialIranianStandardClaim": false,
    "phase1ClassificationRewritten": false
  },
  "rationale": "Stable and draft implementations agree exactly on this scalar punctuation behavior, and legacy v1 supplies independent historical support for the aligned mapping. The project accepts the mapping as a character-level specification rule; this remains a project specification decision, not a claim of current official Iranian national-standard status."
}
