{
  "schemaVersion": 1,
  "id": "FA-ADJ-NUMRULE-005-001",
  "policyVersion": "1.0.0",
  "profileId": "fa-ir-g1",
  "decisionItemId": "FA-NUMRULE-005",
  "queueId": "FA-REVIEW-062",
  "packetId": "FA-EVIDENCE-062",
  "planItemId": "FA-ADJ-PLAN-062",
  "phase1Classification": "REVIEW-REQUIRED",
  "track": "implementation-alignment",
  "disposition": "accept-context-rule",
  "decision": {
    "result": "approved",
    "authority": "project-maintainer",
    "recordedBy": "Soroush Neyestani",
    "recordedAt": null
  },
  "basis": {
    "evidencePacketPath": "spec/fa-ir/review/evidence-packets/records/fa-numrule-005.json",
    "evidencePacketSha256": "AA0BEF02BF55FC8E94C0F7F60C290B7939CD90C71C209FF58031D48DA311A584",
    "sourceIds": [
      "SRC-LIBLOUIS-2054",
      "SRC-LIBLOUIS-G1"
    ],
    "stableDraftRelationship": "same-observed-behavior",
    "unresolvedEvidenceGaps": []
  },
  "materialization": {
    "kind": "context-rule",
    "createsSpecificationArtifact": true,
    "targetRuleType": "context",
    "promotionEligible": false,
    "requiresFuturePromotionGovernance": true
  },
  "scope": {
    "projectSpecificationDecision": true,
    "projectNormativeRule": false,
    "officialIranianStandardClaim": false,
    "phase1ClassificationRewritten": false
  },
  "rationale": "Stable and draft implementations agree on this numeric begin/middle/decimal/end behavior. Because its meaning depends on numeric context, the project accepts it as a context rule rather than an unconditional character mapping."
}
