{
  "schemaVersion": 1,
  "id": "FA-ADJ-LATIN-MODE-001-001",
  "policyVersion": "1.0.0",
  "profileId": "fa-ir-g1",
  "decisionItemId": "FA-LATIN-MODE-001",
  "queueId": "FA-REVIEW-137",
  "packetId": "FA-EVIDENCE-137",
  "planItemId": "FA-ADJ-PLAN-137",
  "phase1Classification": "REVIEW-REQUIRED",
  "track": "implementation-conflict",
  "disposition": "accept-mode-rule",
  "decision": {
    "result": "approved",
    "authority": "project-maintainer",
    "recordedBy": "Soroush Neyestani",
    "recordedAt": null
  },
  "basis": {
    "evidencePacketPath": "spec/fa-ir/review/evidence-packets/records/fa-latin-mode-001.json",
    "evidencePacketSha256": "4EB8D3DC7CB4CCAD34B750BF139FFEA15A53398E42DA114852E34C700E0BBD43",
    "sourceIds": [
      "SRC-IR-1393",
      "SRC-LIBLOUIS-2053",
      "SRC-LIBLOUIS-2054",
      "SRC-LIBLOUIS-G1"
    ],
    "stableDraftRelationship": "different-observed-behavior",
    "unresolvedEvidenceGaps": []
  },
  "materialization": {
    "kind": "mode-rule",
    "createsSpecificationArtifact": true,
    "targetRuleType": "mode",
    "promotionEligible": false,
    "requiresFuturePromotionGovernance": true
  },
  "scope": {
    "projectSpecificationDecision": true,
    "projectNormativeRule": false,
    "officialIranianStandardClaim": false,
    "phase1ClassificationRewritten": false
  },
  "rationale": "The preserved Iranian manual evidence reports a six-dot English span, dot-25 span boundaries, and a dot-6 capital indicator. The draft Liblouis implementation supplies the corresponding Latin mode machinery, while the stable implementation lacks it. The project therefore accepts the draft-style Latin mode architecture, subject to later specification materialization governance."
}
